name,review,rating,count,standev
Philips Avent 3 Pack 9oz Bottles,"I cant thank Avent enoughAs a first time mom I was totally crushed when I could not breastfeed right away(Due to inverted nipples)Well when my daughter was about 1 month old and the pump (also Avent) had brought them out a bit she started breastfeeding the transition was smooth she was a happy Breast and Avent-fed baby for 4 month.Even now 5 month later after daily boiling (in a pot)nipples and bottles are as good as the first timeregarding the leeaking I never had a problem whith that, ... As far as im concerned these are SIMPLY THE BEST And I would highly recomend them to all moms...",5,191,1.620650696503464
Philips Avent 3 Pack 9oz Bottles,"Plain and simple - these bottles leak!  I wish I read the reviews before buying these Avent bottles.  My husband and I knew nothing about bottles so when our baby arrived 3 weeks early, we didn't get to research and quickly bought these. I bought several of them and when they leaked thought maybe there was just a bad one in the batch.  Every time one leaked, I removed it from the rotation.  Well, they all eventually leaked so I can't stand them; it's very aggravating.  I've since bought the Dr. Brown bottles and have had no problems with them.  I even think my baby is less gassy and spits up less with the Dr. Brown bottles.  People complain about the extra parts to clean of the Dr. Brown bottles, but that's less of a pain than having the Avent bottles leak all over you and the baby and wasting formula.  I'm going to write to Avent and see if I can get my money back.",1,191,1.620650696503464
Philips Avent 3 Pack 9oz Bottles,"I have had 3 children, all formula fed from birth, and we only used this brand with the 3rd child - mainly because I could not find the brand I used previously (Canon Babysafe).Yes, they are more expensive, but if you think how many times you use them and wash them ... you certainly get your money's worth.  I only have 6 and this suits us perfectly.I have not had any trouble with leaks and find they seal quite well for outings when they are in my nappy bag.My baby took the teat from birth with no problems.  But I know some mother's who had babies that just wouldn't take this teat and they had to switch brands.  I guess with everything to do with babies it's a case of trial and error to find what suits you and your baby.What I like about the bottles is that the wide opening makes them extremely easy to wash and easy to put formula in.  I used the narrow necked bottles previously and I was forever spilling formula trying to put the formula in with the scoops.  The Avent bottles are also very comfortable for me to hold and easy for my baby to grip on to as well.They suit us perfectly - give them a try and see what you think.",5,191,1.620650696503464
Philips Avent 3 Pack 9oz Bottles,"Yes, we too have experienced leaks with the Avents.  We've tried to figure it out- Is it the plastic ring?  Is the nipple fully inserted?  Is it not screwed on properly?  Is it a combo of all of these things?  Should it REALLY be this difficult????  I've had Avents leak all inside my diaper bag (didn't realize it until I smelled the sour formula), all down my sons chin and neck, and all over the floor.  We still use ours because I hate to waste money, but we have thrown a few away thinking THEY were the faulty ones... only to have other faulty ones crop up.  (My husband refuses to use the Avents now and only uses Dr. Browns.)  I think it may be a combo of the Avent nipple not sealing (make sure you really, really insert it well), and the ring not being screwed on right (check and double check), but in the end it's like that one sock that always gets lost in the dryer.  What could be the mystery problem??",3,191,1.620650696503464
Philips Avent 3 Pack 9oz Bottles,"Do NOT buy these bottles!!  Save yourself from a lot of stress & frustration!!  Our Avent bottles leaked all the time & our daughter had a lot of gas.  I called Avent customer service to find out how I could get my money back & they were extremely rude to me.  I very politely explained my problem with the bottles & the customer service representative immediately got a rude tone with me and said """"There is nothing I can do for you - we do not give refunds.  The problem is not with our bottles - you just are not using them properly.""""",1,191,1.620650696503464
Philips Avent 3 Pack 9oz Bottles,"Many people complain about leaking and I must admit that it happened to me a few times too. So to prevent it from leaking I would screw on the top as tight as I could, and it would still leak. So that's when I figure it out.If you screw on the top too tight it will leak.Im telling you that this is true. My bottles have not leaked once since I figured this out. Just tighten it until it just first feels tight, and it will not leak.Saying that, I absolutly LOVE these bottles. The wide mounth is easy to clean. It's easy to figure out which size nipples to use as the baby outgrows them. And if your breast feeding, they have everything you need and it all works right with the bottles. No extra work! I highly recomend these.",5,191,1.620650696503464
Philips Avent 3 Pack 9oz Bottles,My son is 2 1/2 months old. We never have problems with our Born Free bottles but noticed that he cries and has stomach problems after being fed with the Avent bottles. I will keep them to use when he's older but they aren't good for newborns.,2,191,1.620650696503464
Philips Avent 3 Pack 9oz Bottles,"I've used Avent bottles for all my kids and have been the happiest with them.  The wide neck allows for easy cleaning which is incredibly important.  I like that when I can't nurse baby I know that they have a bottle that is shaped more like what they are used to, making it a pleasant feeding experience rather than a frustrating one.  I did have problems with the bottles leaking when I first started using them, which turned out to be from over tightening the caps on them...once that was fixed we had no more problems.  Great bottles!!",5,191,1.620650696503464
Philips Avent 3 Pack 9oz Bottles,"I would give this system 0 stars if it would let me! I have the whole system, bottles, pump, warmer, pacifiers, you name it. My son hates the pacifiers, newborn size is not large enough to stay in his mouth and next size gags him. They are a bad design overall. The Nuk pacifiers are much better. They are softer and they conform to his face better. The nipples leak like crazy and the milk comes out of the newborn nipples WAY too fast. My son gags on that long hard nipple and then he gulps for air as the milk is being sprayed down his throat. It came out so fast that he would be drenched in milk within seconds of giving him the bottle. They also give him horrible air bubbles. He ends up spitting up a substantial portion of everything he takes in. We stopped using them and got the Playtex nurser with drop ins and he is much happier. The nipple on the playtex nurser is (contrary to Avent advertising) MUCH more like my nipple than the Avent nipple. It is soft and pliable and it sticks out only when he sucks on it-unlike the avent nipple that juts out permanently. Also, the bags on the disposable nurser leak. Their seams are very weak and would leak through both layers even when we double-bagged them. Avent has great advertising-that is about the only thing great about it.",1,191,1.620650696503464
Philips Avent 3 Pack 9oz Bottles,"i have zero complaints about these bottles. wish i had bought them in the first place (i started out with the playtex nurser system). they may be pricy compared to other bottles, but, you don't have to buy liners for these bottles. my daughter found these bottles much easier to hold herself than the playtex ones and these have a bigger selection of nipple flow to choose from (besides slow and fast, where fast for playtex really just means not so slow), so i put them away and got more of these, and my daugher was a much happier baby.what i found with the leaking some people complain about: if there is any liquid in the seal it will leak. this problem can easily be solved by wiping the inside of the ring that holds the nipple and the outside rim of the bottle with a dry rag, and if it squeaks when you screw the lid on, you're not going to have any leaks.hope this helps!",5,191,1.620650696503464
Philips Avent 3 Pack 9oz Bottles,"My daughter was a month early and I am having problems breast feeding so I got these bottles with special ""newborn"" nipples.  This was a big mistake, the flow is way too strong for a premie baby and was pouring out of the bottle all over her and they made her very gassy too.  They may be good for older babies (2-3 months) but not for a newborn.",1,191,1.620650696503464
Philips Avent 3 Pack 9oz Bottles,"These Avent bottles are comparable to Playtex Ventaire and Dr. Brown's bottles in quality for ventilation...  I have found Avent bottles are simpler to put together with fewer parts to assemble...  However, I try not to use them for night feedings because they sometimes make loud squeaky noises as the air flows into the vents...  This unexpected noise has scared my baby on occasion when very quiet through the night...  Otherwise, one of the easiest to use ventilated bottles...  I also like the smaller version of this Avent bottle in the 4 ounce size...",4,191,1.620650696503464
Philips Avent 3 Pack 9oz Bottles,I was happy to read that other mothers have had problems with this bottle leaking and it wasn't just me doing something incorrectly. I recieved 2 Avent bottles as a free promotion and decided to try them. When they don't leak - I like the bottle very much. Sometimes I can get through a feed without a leak and sometimes I can't. I've kept the bottles as spares.,3,191,1.620650696503464
Philips Avent 3 Pack 9oz Bottles,"I agree these bottle leak terribly, from the beginning. My husband figured out the simple engineering flaw, and its kindof appalling they don't fix them. I guess they think mothers like to be messy.",1,191,1.620650696503464
Philips Avent 3 Pack 9oz Bottles,"I purchased these bottle after trying the Playtex Ventaire bottles, which I did not like.  While these bottles did reduce my baby's gassiness and feeding time, they constantly leak.You wouldn't think it would take a brain surgeon to screw the nipple/cap onto the bottle and not have it leak.  But the majority of the time, the formula leaks from the bottle. In the beginning my baby was wearing as much of the formula as he was eating.  I now find myself screwing, re-screwing and re-screwing the cap and holding it upside down over the sink as a test to see if the bottle leaks.  And then, just when you think it's safe,..lookout, the dreaded drip is back.  The last thing you want to do when you have a hungry and screaming baby is waste time testing the bottle to see if it's leaking.  And, it's not just me who has a problem with the bottles,--I know two other moms who have encountered the same problem.  Save yourself the aggrevation and buy another bottle system.This one has a MAJOR design flaw.",2,191,1.620650696503464
Philips Avent 3 Pack 9oz Bottles,I have tried five different types of bottles and these are horrible. Don't waste your money.  Dr. Brown's is the way to go!,1,191,1.620650696503464
Philips Avent 3 Pack 9oz Bottles,"Sent me 3 bottles one of which didn't have a lid in the box.  Crappy quality control.  Just buy them at the store for more money, at least you'll get all the parts with it.  5 stars for avent, -5 stars for seller.",1,191,1.620650696503464
Philips Avent 3 Pack 9oz Bottles,"We have to admit that after 3 weeks of our son crying after feeding time even though we burped him and burped him he still had GAS!!!! We tried the Playtex Brand. We tried the Johnson's Brand.  He still got gas after feeding.  I did some research and figured that the Avent system just might work. He took to it without fussing and low and behold NO GAS!!!! Of course there was the ususal burping, but afterward no crying and no gas.  Thanks Avent!  To those out there who say they get the dribble when feeding, I say: It's not the bottle on the bum. It's the bum on the bottle. You're feeding him wrong. To those who have problems with the formula coming out too slow or not at all, I say:  Hello, have you ever heard of using a sterilized needle to clean it out?  Nipples do get clogged you know.  It's not the manufactures fault that you aren't keeping it clean.  Remeber to sterilize both the bottle and the nipple.  You need both working properly for a happy healthy baby.",5,191,1.620650696503464
Philips Avent 3 Pack 9oz Bottles,These bottles are excellent bottles for to prevent colic in babies.  The price is to expensive.,5,191,1.620650696503464
Philips Avent 3 Pack 9oz Bottles,I have been using these bottles since my son was 3 wks old. We tried every bottle on the market and this is the one he liked.  It was so much like my breast it made switching between the 2 much easier.  But now he drinks formula all the time about 8oz at a time and it is crazy that at 4:00 in the morning I have to stop everything to change him and that makes him even more upset! I know how to screw the top on and I think it is crazy that you have to pay almost $5.00 a bottle and that you have to go through all these things to stop them from leaking!  He also has acid reflux and I thought this would be a great bottle to help with that.  Now I am learning from my mistakes! Were trying to get him to accept a new bottle and it is so hard because the avent bottles is all he wants now! I don't care what anyone says don't use these bottles unless you want more milk on you and your baby than in the bottle! It's crazy they should fix the problem and it's their problem to fix not the parents!! Come on now $5.00 a bottle! I have 12/ 4oz bottles 9/ 9oz bottles that is a lot of money down the drain!!!!!!!,1,191,1.620650696503464
Philips Avent 3 Pack 9oz Bottles,"We are very pleased with our Avent purchases.  We have no leakage problems and these wide bottles are easy to wash.  I am not sure if other systems have this, but Avent has &quot;adjustable flow&quot; nipples.  These nipples have 3 settings for flow, depending on how you hold the bottle.  So, when our baby grows and needs more flow, we don't have to buy new nipples or poke new holes.  Avent also has a small microwave sterilizer that can sterilize 4 bottles at a time...we use it all the time for bottles, pacifiers, etc.",5,191,1.620650696503464
Philips Avent 3 Pack 9oz Bottles,"These bottles came recommended to me, and I am glad I invested the money.  There is a reason why the Avent bottles are a little more expensive than competitors.  I'm a breasfeeding mother, however, when my son turned four weeks old, we wanted to introduce a bottle so his father and other family members could feed him, giving me a break.  He took to it right away, and I note that he latches on the Avent nipple like that of mine.  So, if you are a breasfeeding mother who wants to use a bottle part-time, then these should be your choice!  I also don't see my son having a lot of gas issues, and they clean up real easy, too--not like some of the bottles my friends have used.",5,191,1.620650696503464
Philips Avent 3 Pack 9oz Bottles,"I love the Avent bottles!This is my second child, so I have tried multiple products on the market.  What benefits are heads above the other bottles in my experience include...-- my little guy can manage the wider nipple much more easily with much less air intake than the traditional narrow nipple (we actually use a combination of breast feeding and the Avent bottles without any signs of him being confused or wanting to give up the breast)-- the nipples are durable compared to the Evenflo nipples I used with my first child, so I have not been faced with the problem of constant replacement-- the wider, shorter bottle design keeps the bottle itself from tipping over whether you are using the 4 or 9 ounce size-- the wider bottle design is easier for my little guy to grab onto.  This is a good step toward self-help skills.  I have even started using the sippy cup handles with some bottle feedings to help us move forward into that new world more smoothly.To address the leaking complaint from some reviewers...No matter what bottle you choose, you will have leaking if you do not put it together in a way that works with that system.I was rarely having a leaking problem and found a tip from another reviewer that solved the mystery of the occasional leaker... wet the base of the nipple before assembling the bottle.As a busy mom, I found myself only occasionally putting together bottles after all parts were dry - on those occasions we had leaking.  However, the leaking was pretty minor and easily corrected by unscrewing, wiping the bottle and inner part of the ring, and rescrewing.  After reading this tip about wetting the nipple base with water before assembly, we have been leak free!Now we're looking forward to graduating up to the Avent sippy cups in a couple of months.  Good luck to you in whatever system you find works for your child's healthy eating.",5,191,1.620650696503464
Philips Avent 3 Pack 9oz Bottles,"After many incidences of soaking my daughter by feeding her with these leaking bottles, or shaking them and splattering breastmilk or formula all over the kitchen, I strongly recommend not buying this product.  Of all the things that are challenging and frustrating about caring for a new baby, bottle-feeding should not be one of them.",1,191,1.620650696503464
Philips Avent 3 Pack 9oz Bottles,i love this brand.  they work great.  they will be great for when my daughter has out grown the bottle...i can use them to put her food in when traveling.  the size is so perfect and they stack easily when you don't use the nipples in them.  perfect product!,5,191,1.620650696503464
Philips Avent 3 Pack 9oz Bottles,"These bottles are wonderful! I breastfed and bottle fed my daughter from the begining.  She didn't have any problem with nipple confusion at all, but as she got a little older, she didn't know how to suck on the regular nipples.  I was using Evenflo Sensitive Response nipples.  So, when I bought the Isis pump, I found my daughter LOVED these bottles.  She knew right away how to suck on them, and unlike the Evenflo nipples, the milk did not run all down her chin.  I like the fact that I can pump both sides using one bottle, unlike with the 4 oz. bottles, where I have to switch for each side.  They are a bit expensive, but it definatly is worth it.",5,191,1.620650696503464
Philips Avent 3 Pack 9oz Bottles,"This is an okay bottle when they don't leak.  I know that you have to follow the directions to the letter, however that doesn't always work to prevent leaks from occuring.  When they don'[t leak they are fantastic, when you get a leak they are horrible.  You end up with half the bottle all over your hands and on the baby.  I continue to use them because the are the only bottles my son likes and I have tried them all.  So keep in mind that even though you follow the directions you may still run into leaks.",3,191,1.620650696503464
Philips Avent 3 Pack 9oz Bottles,"These bottles are the best.  We use them for our three month old daughter who is breastfeed and uses a bottle.  We have never had trouble with leaking like others have said.  The bottles are somewhat more expensive, but worth the extra cost.  One piece of advice.....If your child nurses, there is no need to change the nipples to the faster flows as they get older.  We changed nipples to the slow and medium flow and it was too fast for her (I wish someone would have told me this before we bought all the other nipples).  We are switching back to the newborn nipples (see AVENT web-site for this info).  Since these bottles are so great, our daughter makes an easy transition from bottle to breast.",5,191,1.620650696503464
Philips Avent 3 Pack 9oz Bottles,"I switched to these bottles when DD was approx. 5 months old.  I *love* these bottles.  They have been wonderful for her spit up issues and they are easy for both her and I to hold.  Let me start by saying I was very hesistant about buying this bottle due to the bad reviews about it leaking.  I have not had this problem.  I have found (another user posted this and it works) that you should always assemble the nipple and the ring whilst wet and when you are screwing the ring on to the bottle, give it a counter clockwise turn until you hear it ""click"" into place and then proceed to turn it clockwise until closed.  Also, do not tighten it down like Heman would.  You just need it to be closed and sealed.  Another thing that made my purchase worry free was the fact that I bought them from Babies R Us and told them of my concerns and they told me if the bottles leaked, I could bring them back with my receipt.  All in all, these bottles are great and we have not had one problem.  I will use these with any subsequent babies as well.",5,191,1.620650696503464
Philips Avent 3 Pack 9oz Bottles,"I bought these bottles because it was the ""THING TO DO"", but I am not satisfied at all.  I thought I was crazy, until I started asking around.  The Avent bottles definitely have a tendency to leak.  Sometimes they don't, but most of the time they do!  I can't seem to figure it out.  The leaking is incredibly frustrating.  (...)",2,191,1.620650696503464
Philips Avent 3 Pack 9oz Bottles,"There are already hundreds of reviews with plenty of opinions, but one thing you might want to know is that the 9 oz three-pack comes with 1m+ ""slow flow"" 2 hole nipples.  (Not the 0m+ newborn 1 hole nipples.)",5,191,1.620650696503464
Philips Avent 3 Pack 9oz Bottles,Every time I would try to feed my 3 month old daughter it would end up down the front of her shirt instead of down her mouth. WHAT A WASTE OF MONEY AND MILK!,1,191,1.620650696503464
Philips Avent 3 Pack 9oz Bottles,I chose these bottles because they were thought to be the best and most expensive on the market and was very disappointed. I got the whole system and later realized that the bottles leak! I had many frustrating nights changing my son's clothing at 3:00 am because he was completely soaked from these bottles leaking out of the side.It is very hard to tell how much he was getting considering that half of the bottle was leaking down the side. Every member of my family has tried to prevent the leakage and it is impossible! After all the money invested in this product I am very disappointed and do not recommend these bottles to anyone.,1,191,1.620650696503464
Philips Avent 3 Pack 9oz Bottles,"Before my son was born, I spent a lot of time reading the reviews on the different feeding systems.  Because we live on a small base in Germany, we do not have a wide selection available to us at out Post Exchange.  I bought a few bottles from the PX and tried them out, but he didn't like any of them.  They would allow the milk to dribble down his face or not enough milk would come out and frustrate him.I bought a single Avent bottle... they were the most expensive and I was hesitant to invest so much money on the Avent system.  I followed the directions (something that a few of the other commenters are obviously not doing) and this bottle worked the best.I have bought a ton of Avent products and they all work fine!  The only time my bottles leak is when my dear hubby fills them... he doesn't follow product instructions LOL.",5,191,1.620650696503464
Philips Avent 3 Pack 9oz Bottles,"I loved the Avent bottles.  I am breastfeeding my son and needed a bottle that would be like my breasts.  At first i used the Playtex Vent-Air, but when i would breast feed him he would be confused, but none of this happened with Avent!",5,191,1.620650696503464
Philips Avent 3 Pack 9oz Bottles,"My daughter was born 3 & 1/2 weeks early and had to stay at the hospital for a week, she was lazy at the breast but did great with these bottles which came highly recommended by a friend.  I only have an ocassional problem with leakage when you twist it shut it seems that every 1 in 10 times it leaks.  I don't mind the leaking except that it takes several tries to re-twist it before it stops leaking.  I hate losing precious breastmilk to leaks, thats why I gave it only 4 stars.",4,191,1.620650696503464
Philips Avent 3 Pack 9oz Bottles,"We have uses these bottles for 2 months.  About 1 out of 3 bottles leak.  And we're not talking a drop or two.  We're talking about milk flowing out of the cap as if it's not even secured.  You can insert the nipple into the screw cap, hear the ""click"", squeeze it tight, squeeze it loose, squeeze it any degree between, but they leak.  AVENT's website even has a section on how to prevent the bottles from leaking. You want to know why?  Because they leak.  AVENT bottles must be the poorest designed product we have used in the past year.  They leak, and they leak.  They leak at the worst times, they leak and the best.  If you want to ensure that your feeding experience with your child will be ruined 33 percent of the time, by all means -waste your money on this poor excuse for a product.  AVENT should be ashamed of themselves.",1,191,1.620650696503464
Philips Avent 3 Pack 9oz Bottles,"I have read a review (probably from the manufacturer) suggesting people are experiencing dripping because we don't follow directions. I have two kids, and believe that the problem is just that the bottles are poorly designed. I have had to change my kid's shirts at three in the morning because they get wet from the bottle. This is so frustrating that not only am I taking the time to tell anybody who is interested to not buy this product but I am also writing the manufacturer to complain and get my money back. Save your sanity, it really is that frustrating.",1,191,1.620650696503464
