name,review,rating,count,standev
Philips Avent 3 Pack 9oz Bottles,"I was recommended to use these bottles by a girlfriend who had used them with her baby and sworn by them. I started with a set of 4oz bottles with newborn nipples (#1) and have graduated now to the 9oz bottles with the next size up nipples (#2). I will simply buy new nipples when she's ready for the next step. I am absolutely thrilled with these bottles.  I do have an occasional leak but it is always my own fault for not screwing the lid on tight enough!I have not had any problems with leaking when I have them put together correctly. They were especially good for going back and forth between breast feeding and bottle feeding. My now 4mos old baby never had any difficulties feeding either way and transitioned very smoothly. One reader referred to air being pushed into the bottle during feeding and causing her baby to swallow air. The air wooshing in is a good thing! It prevents a vacuum from developing inside the bottle and allows the baby to continuously feed without having to stop to relieve the pressure inside the bottle. The only time I ever had any problems with mine swallowing air was when she had pretty much outgrown the newborn nipples and would try to suck too hard when she was very hungry. This was immediately corrected by buying the next size up. They're also very easy to clean and can be effectively washed in the dishwasher because of their wide neck. Regular bottles cannot. I, out of necessity, used another brand of bottle with her today at a relative's house and was reminded why I like Avent bottles so much!",5,191,1.620650696503464
Philips Avent 3 Pack 9oz Bottles,"If I had not been given a ton of Avent bottles, I would have chosen some other system.  The leaking is terrible!!!  You have to buy the disks separately, you should get them for free because they are absolutely essential.  The only way to mix formula in the bottle or transport liquid is to use the disks in the ring, then switch to the nipple when you are ready to feed.  The only reason I give it a two is because I do like that you can pump directly into the bottle with the ISIS breast pump.  And, I like the sippy cups.",2,191,1.620650696503464
Philips Avent 3 Pack 9oz Bottles,Leaks! Especially difficult to get a tight seal if you use one hand (while holding baby). A much better design is the Breast Flow Learning Curve First Years bottles. Instead buy The First Years 3pk. Breastflow 5oz. Bottles These worked much better for me.,1,191,1.620650696503464
Philips Avent 3 Pack 9oz Bottles,"I have been using the Avent bottle system for six months and have been completely satisfied. I introduced an Avent bottle to my daughter at four weeks old and she transitioned easily between breast and bottle. She is still breastfed in the morning and evenings but receives an Avent bottle at daycare and has never had a problem. I have never had a bottle leak of which other consumers have complained. I would recommend this system to any parent, especially those of part-time breastfed babies.",5,191,1.620650696503464
Philips Avent 3 Pack 9oz Bottles,"I used Avent bottles with my son when he was two weeks old. We only used them on the rare occasion I wasn't available to nurse him (first time was a funeral!). He NEVER had a problem latching on the bottle nipple, and then back to me when I got home. Expressing milk and having Dad, Grandma and Grandpa give him bottles now and then was nice for everyone involved. I can't recall a single time the bottle leaked as others complained. Perhaps it's not the brand that was the problem but the individual nipple or bottle. Also, he was used to working harder at my breast to get milk, but never seemed to get too much from the bottle, no matter how hard he sucked. Again, maybe it was that particular nipple, not the whole brand. Anyway, I loaned all of my Avents to my friend when he adopted a newborn. She's an Avent Girl all the way! Now that my second child is on the way, I'm registering for more!",5,191,1.620650696503464
Philips Avent 3 Pack 9oz Bottles,"These bottles are simply the best out there. I know, I tried ""ALL"" of them.",5,191,1.620650696503464
Philips Avent 3 Pack 9oz Bottles,I purchased these bottles for my older baby who drinks more than 9 oz at night.  These work well for us because we don't have to refill them as often and the nipples work on his trainer sippy cups from avent.,4,191,1.620650696503464
Philips Avent 3 Pack 9oz Bottles,"After reading the reviews of these bottles leaking, I personally found a way to keep from it.  When heating in the express bottle heater (after being in the fridge), I loosen the top of the bottle to let the pressure out.  After its ready, I then take the whole top off, wipe off the condensation on the rim (inside and out), then screw on snug, but not real tight.  It solves the leaking problem.  Another review I read said that screwing on too tight also causes leakage.  Ive not had a leaking problem since I started doing this.",5,191,1.620650696503464
Philips Avent 3 Pack 9oz Bottles,I really wanted to like these bottles because they are wide and they don't have any funny parts. But these things leak and leak. What a shame.,1,191,1.620650696503464
Philips Avent 3 Pack 9oz Bottles,"In the midst of all of my bottle testing, I was against Avent, mostly because they do cost a bit more than most bottles.  I thought that I could test a bottle and cup, to see if Avent was really telling the truth when they said all the parts were interchangeable.  Well, they are.  They also have more nipple selections, depending on how fast your child drinks.One thing I wish Avent has was a design or something on the bottle. I did find that if you buy the Evenflo Cool Pals 9 oz. cup holder, these fit in them great.I would suggest only getting 2 packs of these, couple of Magic Cups with handles and some extra spouts (have at least 2 green ones and 1 white one).",5,191,1.620650696503464
Philips Avent 3 Pack 9oz Bottles,"I had started with these bottles.  Then I called AVENT, and they told me these bottles contain BPA.  I switched to the Tempo Liner bottles and they work just as well.",1,191,1.620650696503464
Philips Avent 3 Pack 9oz Bottles,"The Avent system works great!  We have never has air/gas issues, and our daughter has never experienced nipple confusion.  We had to introduce the bottle at four days old and went back to the breast at one month without issue.  The nipples can be used on the sippy cups, the nipples can be replaced with storage inserts.  I use these bottles to tote food and to freeze homemade food.  I like the various number of hole nipples you can buy.  This is an excellent bottle!",5,191,1.620650696503464
Philips Avent 3 Pack 9oz Bottles,"I bought these for my daughter. I have been using them since she was born, but I have had (like a lot of other people) trouble with them leaking. I have had so many problems with leaks that I am considering not using them for my next child. Sometime the only way to fix the leak is to take the nipple out of the ring and run water over it. As you can imagine, this is not very helpful when we are away from home. I have tried to just not screw them down as tight, but it doesn't always work.",2,191,1.620650696503464
Philips Avent 3 Pack 9oz Bottles,"These bottles are terrible~once you get comfy with baby and start feeding~they leak all over, then you & baby are soaked (and smelly~especially when on whole milk) and no longer relaxed.  Terrible!!!",1,191,1.620650696503464
Philips Avent 3 Pack 9oz Bottles,"I had been afraid that my breastfed baby would prefer the bottle once I started pumping. Instead, we found that he did not like the bottle at all. We had received a free sample of the Avent bottle, and discovered that he liked the nipple much more than the ones on the Medela nursing set that goes with my breast pump. He still would much rather get the real thing, but daddy finds it much easier to feed him with the Avent bottle. My one concern is that the plastic is much more rigid than that of the Medela set...am afraid of dropping over hard surface.",4,191,1.620650696503464
Philips Avent 3 Pack 9oz Bottles,"Avent bottles are the closest to mother's breast as far as the nipples and the shape and quanity it holds is great. It is very easy to pump breast milk into. I have tried other bottles but i keep coming back to Avent they are the best. All Avent products are superior to all others.Mom of 2 children and one on the wayI will only use Avent for my kids.ThanksAna Soto, New York",5,191,1.620650696503464
Philips Avent 3 Pack 9oz Bottles,I'm not a big fan of these bottles.  I think they let too much air into my baby's belly.  I think they are generally over rated.  I do however have to stick up for them.  They do not leak if put together correctly.  The most important thing is to make sure that they are completely dry before putting them together.  If there are wet at all they will leak.  Also you have to make sure you have the nipple fully pulled through the cap.,3,191,1.620650696503464
Philips Avent 3 Pack 9oz Bottles,"I love these bottles! I haven't had any problems with leakage as I did with other brands, and I just love how Avent makes other products too. I have the bottles, sterilizer and the breast pump and I love them all!",5,191,1.620650696503464
Philips Avent 3 Pack 9oz Bottles,"I bought these bottles for my first child 2 years ago and loved them then.  Now with my newborn, they are still like new, and I still love them.  I breastfeed her, but she takes one bottle a day without a problem.  Yes, if the white rim is screwed on too tightly, they will leak.  Simply check before feeding.  I've really enjoyed using there entire feeding system from bottles to sippy cups to sterilizer.  Very well made products.",5,191,1.620650696503464
Philips Avent 3 Pack 9oz Bottles,"i was pumping for my daughter when she was born and used these bottles and they were great for storage and easy conversion to a bottle, however the milk leaked out of her mouth all over the place and breast milk is precious. i wasted alot and ended up switching to another bottle. also the flow was too slow on the stage 1 and too fast on stage 2 for her as a newborn. it took almost 25min for her to finish 3-4oz. while it only took 10 or so with a standard bottle. Easy for starge to bottle conversion though.i do not recomend these bottles.",2,191,1.620650696503464
Philips Avent 3 Pack 9oz Bottles,"You turn the cap less or you make it tight,No matter how you try, you wont get it right.You think they drank four, but they only got three,Because below their mouths, the bottle's on a leaking spree.The thing is going to leak, screw it as you might.Who needs this aggravation, at 3 in the night.Warm milk or cold milk, no matter what it holds,Its gonna leak out and seep into their neck folds.You'll need a calibrated wrench, from the Institute of Measures,Who needs these leaky hassles, to feed their little treasures.Each time I use them now, I end up swearing,Many have leaked similar complaints, how can Avent be so uncaring?",1,191,1.620650696503464
Philips Avent 3 Pack 9oz Bottles,"I have used both the 4 oz. and the 9 oz. bottles to feed my 3 month old son, and the bottles are so leaky!  The problem seems to have gotten progressively worse over time because now they leak to the point that I'm not sure how much my son is ingesting and how much is soaking his bib and burp cloth.  I tried adjusting the nipple and tightening or loosening the collar - nothing has stopped the leakage.  I have switched to Gerber New Traditions bottles with no problem so far.  I gave this product 2 stars instead of 1 because the nipple shape is very similar to the real thing, and that's always a plus for someone who wants to combine bottle and breastfeeding.",2,191,1.620650696503464
Philips Avent 3 Pack 9oz Bottles,"As a mother of four, I have tried just about everything out there in the way of bottles.  Now I have a 5 week old daughter and she loves the Avent bottles.  I have never had an issue with nipple confusion.  She also uses the Avent paci's.  No problems at all with going from breast to bottle to binky.  I have read other posts about the bottles leaking or not getting any flow from the nipples.  I hate to say it but these posters are not using the products properly.  If I were exclusively bottle feeding this child, like I did the others, I would completely understand about sleepy 3am bottle woes.  However a simple remedy would be to put them all together after they have been washed.  Why would anyone wait until baby is hungry to put the nipple into the ring?  I think some people are just asking for more work.  That being said, I am now a die-hard Avent fan and use many of their products.  I hope others will do the same!",5,191,1.620650696503464
Philips Avent 3 Pack 9oz Bottles,"My son has reflux so we have an ongoing battle with spit up in our house. When I stopped breast feeding I tried a couple different types of bottles and eventually ended up sticking with Dr. Brown's because they helped the most with his gas and spit up. After 3 months of washing all of the parts that Dr. Brown's bottles have, I decided to try Avent. I like the bottles, they are made of a good quality material and they are wide, which made it really easy for me to mix formula in them. My son didn't have a problem latching on or anything, and his gas didn't get any worse, but his spit up became out of control!!!! He began spitting up twice as much as he did on the Dr. Brown's bottles. I was forced to switch back to Dr. Brown's because I just couldn't handle changing his clothes and mine 5 times a day. So they just didn't work for my baby. However, I never had a problem with them leaking...they are pretty good bottles!",3,191,1.620650696503464
Philips Avent 3 Pack 9oz Bottles,"Since I knew I wouldn't be breastfeeding after returning to work, I began researching bottles before my daughter was born.  Avent bottles received great reviews and now I know why.  The transition from nursing to bottles was a breeze thanks to the patented design of the Avent nipples.  My daughter never developed nipple confusion and never once rejected feeding from the bottle.  The Avent bottles with the wider neck are easier to clean and the Avent sterilizing system makes them even easier to sterilize.  I recommend this product to any mother who wants whats next to best when it comes to feeding their newborn.  Of course, nursing is the number one method.  The only reason why I didn't rate this product a 5 star product is because the bottles are unusually wide.",4,191,1.620650696503464
Philips Avent 3 Pack 9oz Bottles,"The only drawback I've seen to these bottles is they sometimes leak and the nipples are too tall to fit in the top of my nipple washer for the dishwasher.  Other than that, it's great!  I do recommend getting some of the &quot;older&quot; nipples as my daughter got frustrated with the bottle with a newborn nipple on it as she got older.",4,191,1.620650696503464
Philips Avent 3 Pack 9oz Bottles,"I started using these bottles prior to going back to work, wanting a bottle similar to the (...).  My daughter took the nipple, no problem.  I didn't have a problem with leaks...as everyone else noted, you just screw the nipple ring on lightly and assemble the nipple and ring while wet...that's all it takes.  I do however have a problem now with terrible gas build up in the evenings and gas noises that make my husband blush!!! .  You moms know the screams of a baby with gas build-up...it's awful.  I had been using gas drops, but wanted a solution and not a quick fix. I switched to the Dr. Brown's bottles and she hasn't had the painful gas since!!!",1,191,1.620650696503464
Philips Avent 3 Pack 9oz Bottles,"The appearance and size are nice, but these bottles cost too much to have them leaking all over you when you are trying to feed your baby. They are not worth the money because they leak way too much.",1,191,1.620650696503464
Philips Avent 3 Pack 9oz Bottles,"OK first they are easy to clean.  Second the nipples DO NOT collapse. Third, they cut down on bubbles.  Sometimes they leak, but thats easy to cure...DONT SCREW EM ON SOOOO TIGHT!  LOL....buy em, you wont go wrong!",5,191,1.620650696503464
Philips Avent 3 Pack 9oz Bottles,"The Avent bottles leak terribly.  I would not recommend buying them to anyone.  It is hard enough waking up in the middle of the night to feed, but add in getting all wet (me and baby).  It isn't just me who has had this problem, which I initially thought.  I have asked several people if this has happened to them and it has.  We've even tried purchasing new nipples, thinking it was that, and it didn't matter.  The bottles seem to have a defect, according to a friend who used to use them years ago and NEVER had the problem then (but NOW does).",2,191,1.620650696503464
Philips Avent 3 Pack 9oz Bottles,I had nothing but leakage problems with these bottles. I contacted the company and they told me all these different tips of assembling the bottles that should stop leakage. Needless to say none worked. Luckily for me I was able to return the larger bottles. I am although stuck with eight of the smaller ones. First off let me say when you are sleep deprived you dont' want to be worrying if the bottle lip has a drop of water on it that will cause it to leak or if you have over tightened or under tightened.  There is no time to worry about all these little things when you have a hungry screaming baby. The bottles are by far not cheap and there shouldn't be so many issues.  I have many friends that have said that theirs leaked as well...too bad they didn't tell me before I registered for them.  Oddly enough if you buy a bottle in the .99 cent store you don't have all these issues.  When I returned the larger ones to Babies R US there were a lot of other returns as well.  I will give these to my daughters to play with their dolls.  In addition to the leakage I noticed that my son was extremely gassy and would cry so much after eating.  I have told my friends who are registering now to save their money and find an alternate bottle.,1,191,1.620650696503464
Philips Avent 3 Pack 9oz Bottles,"These were the only bottles I ever gave to my baby, so I'm not sure if she would have liked something better, but she seems to really like them now.  She does seem to like the nipple shape and the air stays out of the tip.  The only drawback is that they leak and squeak loud if you tighten the cap too tight.  Overall, we are very happy with the Avent bottles and nipples, I probably wouldn't buy anything else.",4,191,1.620650696503464
Philips Avent 3 Pack 9oz Bottles,"Yeah, they do leak sometimes, but to me it's no big deal.  Yes, there doesn't seem to be a pattern, but again, it doesn't happen frequently enough to really wig me out.",4,191,1.620650696503464
Philips Avent 3 Pack 9oz Bottles,I have read the past few reviews given for these bottles and I wonder if we are talking about the same bottles.  I too breastfeed and pump. I have tried the Dr. Brown bottles and the Evenflo Ventair bottles and have to say that none of them can even come close to these bottles.  I am yet to see one drop of milk drip out of the bottle.  Maybe the ladies are not assembling the bottle tops correctly!LOVE THEM!,5,191,1.620650696503464
Philips Avent 3 Pack 9oz Bottles,"I like the avent bottles a lot... the tops are extra wide to be able to put formula mix in, without getting it all over the counter.  I don't think these bottles seem to help my son with gas, he's just a baby, and they are generally gassy.  The bottles do tend to leak if the inside of the white ring is not completely dry first.  Overall I've been pretty happy with them though, I've never contempated switching.**I do however recommend just skipping the 4 oz bottles and buying just all 9 oz bottles... My son is 3 weeks old and is already taking 6 oz, so anytime we use the 4 oz bottles, we have to make an additional 2 oz after he empties the bottle.  I wish I had just registered for another package of 9 oz instead of 4 oz.",4,191,1.620650696503464
Philips Avent 3 Pack 9oz Bottles,I registered for these bottles because all of my friends recommended them. My 3 week old daughter has difficutly with these bottles because the formula just pours out the sides of her mouth. She used the Stage 1 nipple and they are too fast for her. We tried the Playtex Ventaire- she latched on well to those but they caused too much gas. She cried in pain. Today I'll be making a trip to purchase Dr. Brown's bottles to see how they work...,3,191,1.620650696503464
Philips Avent 3 Pack 9oz Bottles,This bottle was a life saver.  I didn't think anything about the leaking because babies are washable.  I was able to put her ceral in the bottle before bed time and the hole house got a good nights sleep.  My daughter has less gas and is happy when I put fruit and other things in this bottle.  It's just a wonderful bottle.,4,191,1.620650696503464
Philips Avent 3 Pack 9oz Bottles,"I have been using Avent bottles for 5 months and was unaware of any problems with leakage until I read these reviews. I purchased the breast pump pack with bottles in Australia, where I'm from, and used them several times a week when I needed someone else to feed my baby breast milk. My breast milk became ineffective after 4 months so I am using the bottles full time to feed my baby formula and still have never experienced leakage. I've also purchased bottles from here in the U.S. and still had no problems. I'll admit too that I'm not a good one for reading instructions so after sterilising the bottles they are sometimes assembled dry and sometimes wet...I didn't know it made a difference (obviously it doesn't). Mine have always been hand washed though. I don't like to put them in the dishwasher. From someone who breastfed for 4 months before putting my baby onto formula I find the Avent nipples excellent and simulate a real nipple very well. My baby's lips sit over and under the rounded part of the nipple just as they did on my breast. My baby also has trouble bringing up wind but the problem is nowhere near as bad when he uses the Avent nipples as I've been able to control the flow with their numbered system....he takes in nowhere near as much air as a nice slow flow prevents him from having to gulp quickly. I couldn't be more pleased with the performance of Avent bottles.",5,191,1.620650696503464
Philips Avent 3 Pack 9oz Bottles,I have been nursing and am now switching our daughter to abottle.  We've tried several different bottles and these were the ones my daughter will take.  We have a terrible time with them leaking.  Breastmilk is like gold to me and its very frustrating when I pull the bottle out of the diaper bag with half of it all over the bag!!  We are currently trying different brands again.,2,191,1.620650696503464
Philips Avent 3 Pack 9oz Bottles,"These bottles leak.  It doesn't matter how you assemble them, or if you assemble them wet, or dry, or in space, or in a cave.  They leak.  Terribly.  And Avent knows it.  They will even replace your leaky bottles if you call 1800 54avent.  Of course the ones they replace it with also leak.  Buy Dr. Browns instead.",1,191,1.620650696503464
Philips Avent 3 Pack 9oz Bottles,"Just when you least expect it for no obvious reason these bottles leak.  And by leaking I mean leak A LOT.  A lot of milk dribbles out...down your arm, onto your lap...all over your chair.  It's really annoying, especially since these bottles are NOT cheap.  You'd think they could design them better than this!  And after awhile, just when you forget how much they leak...bam!  It happens again.  This is the second time I've used these bottles (I kept them for my second child because they cost so much I didn't want to replace them) and the leaking has annoyed me so much that I was inspired to get online and post this review!  You'd think after all this time I would have figured out how to keep them from leaking, but no, there's no rhyme or reason to it.  I would strongly recommend another brand.",1,191,1.620650696503464
Philips Avent 3 Pack 9oz Bottles,"very leaky...when you call they dont ake the situation any better. They say it's do to washing bottles with anti bacterial soap, etc. botto line these bottles stink and they are expensive. Don't bother!",1,191,1.620650696503464
Philips Avent 3 Pack 9oz Bottles,"I registered for these bottles because I got the manual breast pump from Avent.  The breastpump was phenominal but trying to feed my baby with these bottles, whether using breastmilk or formula, was impossible.  The nipples get clogged and my son got frustrated from sucking so much.  Also, they leaked every where, whether from saking them to mix the formula or just by feedin the baby, they always leaked.  I wish I could get my money back.  I went and bought Gerber bottles, which work perfectly!",1,191,1.620650696503464
Philips Avent 3 Pack 9oz Bottles,"Come on now, ladies...As a mom of 4, 41 years old, former child care provider, I have dealt with a lot of bottles. I can tell you that if you screw the lid on ANY bottle too tight, it IS going to leak. Solution? Shake the bottle well before popping it into your dear one's little mouth. If it should leak, loosen it, and screw it on again, do a test shake, and you're off! We recently adopted two little ones (my older ones are 11 and 9, the little onesare  22 months and 5 months), and my youngest is the first baby I've fed exclusively with a bottle. I have been very pleased with the ease of use of the Avent bottles, especially with how easy they are to clean.",5,191,1.620650696503464
