name,review,rating,count,standev
Philips Avent 3 Pack 9oz Bottles,"Both bottles do a fine job of keeping bubbles out of your baby.  We tried and used both bottles with our boy.  The real deal between the two is the nipple.  The nipple on Avent bottles are larger at the base and firmer than the Brown bottles.  When we first introduced the bottle to our breast fed boy he did not take to the Avent bottles.  He just couldn't get comfortable around the nipple.  We switched to Dr. Bown's and he took to it with little problem.  As he got older and bigger we later switched and are currently using the Avents.  Why did we switch?  Cleaning Dr. Brown's bottles SUCKS!  There are so many little parts that all need special brushes to clean with that it takes forever to wash bottles.  Plus, the Brown bottles are thinner but taller and just don't seem to pack away as well.  However, if your baby is picky there isn't much you can do.  For expecting parents, I would not recommend buying a bunch of one type over the other.  Buy one of each first and see which one you baby is comfortable with.",5,191,1.620650696503464
Philips Avent 3 Pack 9oz Bottles,"...I really wanted to get him used to the bottle so that I could leave him with my brother, and nothing else worked so I tried the Avent. Well, it didn't work either. My kid preferred the real thing. I guess the Avent doesn't work for everybody....",2,191,1.620650696503464
Philips Avent 3 Pack 9oz Bottles,I love this bottle.  It's sturdy and easy to clean AND it's the only bottle my breastfed baby will take.  We tried everything and she refused it all until we found the Avent :),5,191,1.620650696503464
Philips Avent 3 Pack 9oz Bottles,"My daughter did wonderful switching between breast and bottle with Avent.  However, I am so frustrated with the leaks.  I have to screw and unscrew the top multiple times with a screaming baby in my arms.  Even then it sometimes leaks.  I heard how great these bottles were, I wish I would have known about this ahead of time.  The next baby will use a different brand!",3,191,1.620650696503464
Philips Avent 3 Pack 9oz Bottles,These bottles are so frusterating! They leak all over the place.  The only thing these bottles are good for is mixing formula. The wide neck bottle makes it easy to pour the powder.,2,191,1.620650696503464
Philips Avent 3 Pack 9oz Bottles,"THEY HAVE A GOOD QUALITY FOR THE PRICE, IN MY COUNTRY THE BUTTLE AVENT ARE SO EXPENSIVE, I LOVE TRADE AVENT",5,191,1.620650696503464
Philips Avent 3 Pack 9oz Bottles,"I loved this the forst time I tried these bottles. I mostly breast feed and this bottle seemed to be the only one he took to. BUt I need to continue my search because he gets soaked as these DO LEAk. I have used them 3 times and since the second time he is soaked.  I don't wash them in the dishwasher either. great nipple, bad leaking. Too bad!",3,191,1.620650696503464
Philips Avent 3 Pack 9oz Bottles,"We began using the 4oz Avents at the recommendation of our lactation specialist, whose opinion was that this brand offered the nipple closest to the human breast. When we discontinued breastfeeding, we stuck to the brand and moved up to the 9oz size. The wide mouth is easy to fill and clean and I appreciate the clear markings in both oz and ml.We bought the first few new and then purchased the bulk 2nd and 3rd-hand. Our oldest models show very little wear - a testament to the quality of the product.Nipples come in a variety of flows (beware the multi-flow, however) and Avent even has a sippy-cup attachment to use later when our baby starts drinking juice. Overall, these were a great investment.",5,191,1.620650696503464
Philips Avent 3 Pack 9oz Bottles,"Boy, were we wrong.  I chose these bottles based on glowing recommendations from my veteran-parent friends who had no feeding issues with any of their babies.  Add to that the literature that promises that Avent bottles are great for transitioning breast-fed babies back and forth from breast to bottle and that they reduce the colic and gas in babies.  With all that, who could go wrong, right?  So we registered for multiple Avent products and seriously stocked up when our generous family and friends shopped off our registries.  Then along came our son.  From the start, he was fussy during and after feedings with Avent bottles and would take only about an ounce per feeding even as he grew in age and size; then he would scream and cry for a long time as if he were both angry and in terrible pain.  Classic colicky baby, right?  We struggled for about 2 months with these bottles and finally gave up.  A friend had given us her daughter's Dr. Brown bottles to try and up until that point, I refused to use them because they were so complicated with all those parts; we were so glad we did finally try them because almost instantly, our son doubled his milk intake, burped less, cried less, and smiled more.  This led to better sleeping and overall household peace.  Our daycare caregivers couldn't be happier either because they had to put up with all his fussing and screaming.  So given the choice to do it again, I would save the frustration and misery and register for a bunch of Dr. Brown bottles because they've saved my sanity and really improved my son's quality of life.  Maybe I can sell all these Avent bottles on Ebay or something!",2,191,1.620650696503464
Philips Avent 3 Pack 9oz Bottles,"I nursed my son and was very nervous about introduing a bottle. I had heard about all these HORRIBLE experiences that women have had... from thier babies not taking a bottle, to having to trying many different bottles and so on... it was very scary. One day my husbad and I were buying a new car and I had the option of nursing in the bathroom (which was gross) or using the bottle that I had pumped for these reasons in the first place. I choose the bottle and my son had no problems at all. He was so happy, I started to pump more and use the Advent bottles more and more. The four ounce bottles are great for little ones. We love advent products I was able to swich from nursing to bottle with out any problems at all!!! Plus now as he's growing they have different sizes of nipples that you can use and these great sippy cup tops that fit onto the bottles....My son is still using them and he's six months old!!!",5,191,1.620650696503464
Philips Avent 3 Pack 9oz Bottles,"I first experienced using the AVENT brand when my nephew was an infant. They were easy for him to use without nipple confusion. Unlike the traditional bottles made by Gerber and Evenflo, the AVENT are easier to clean...no bottle cleaning brush is needed. I was amazed at how my whole hand and dishcloth fit into the bottle. I never experienced leaking with them the times I had used them. They are also easier for the baby to hold.Any friend that is expecting, I get them the AVENT bottles and they end up wishing that they had registered for them.",5,191,1.620650696503464
Philips Avent 3 Pack 9oz Bottles,My son and I love this bottle. With this bottle he never experienced nipple confusion. I have used the Avent system for a year and my bottles have never once leaked. They are also very easy to clean.,5,191,1.620650696503464
Philips Avent 3 Pack 9oz Bottles,"We recieved these bottles as a gift for our son (now 16 months)and expected greatness from Avent. When I opened the first package I was amazed at how stiff the nipples were that are included with these bottles. Stiffness is hardly a correct simulation of the breast. The bottles are also very wide and hard for little hands to grip when they begin to hold their own bottles. I also saw no indication that my son got any less air from using the Avent system. I MUCH prefer the softer, easier to hold, less air producing Playtex Nursers which is what we ended up switching him to.",3,191,1.620650696503464
Philips Avent 3 Pack 9oz Bottles,These bottles are the perfect size and work great with the Avent Isis breast pump. I never had a problem with them leaking at all. You can freeze with them too. The 4 oz. size is perfect for the breastfeeding mother. The milk doesn't come out fast at all. Great bottles.,4,191,1.620650696503464
Philips Avent 3 Pack 9oz Bottles,"We used these bottles right from the beginning (our son had troubles nursing) and our son loved them!  Our son experienced some pretty bad days of gasiness, but overall, no real problems.  We did have a lot of issues with the bottles leaking and found that having to change nipple sizes was a bit annoying.  A variable flow nipple would have been much easier than having to switch between nipples with different numbers of holes.  These were much easier to use than the Avent disposable bottles, which tended to leak and didn't allow me to push the air out.  Our son was able to hold these bottles by himself when he was about 6 months old, so that was a real benefit, and we also used the sippee adaptor on them which really extended the life of the bottle!",3,191,1.620650696503464
Philips Avent 3 Pack 9oz Bottles,"A nurse at the hospital recommended these bottles to us after I had my daughter.  They worked great for a few weeks, but then they started to leak.  When they leak, you can take off the lid and rub your finger around the inside of the rim to strengthen the seal.  It stops it from leaking, but it's a hassle.  Being a first time mom, I thought perhaps this was a problem with all bottles, but my sister uses playtex bottles and has never had a problem.",1,191,1.620650696503464
Philips Avent 3 Pack 9oz Bottles,"I have read other reviews about the Avent bottles, and I have to say that we have experienced no problems whatsoever with these bottles. Our son is now almost 6 months old, and the one time we experienced a leaking problem is when the lid was put on crooked. Also, I have never had a problem with them smelling like plastic or with the measurement lines fading. After nearly six months of use, these bottles have been dropped, washed, sterilized, soaked and put in the dishwasher, and we still have no complaints. Also, they are super easy to clean due to the larger opening at the top. We are so happy with the Avent bottles that we have even saved them for use with our future children. The only knock I give is for the 4 oz. bottles. I wish I would have bought only 9 oz. bottles because my son graduated past the 4 oz. mark quickly, and I feel that even purchasing the smaller bottles was a waste of money. Overall, I highly recommend the Avent bottles, but again, I would recommend only buying 9 oz. bottles.",4,191,1.620650696503464
Philips Avent 3 Pack 9oz Bottles,"I absolutely love ALL Avent products... their bottles, bottle-warmer, pacifiers, etc.Both of my boy used the Avent bottles, and the ones my first-born used are still being used by my second one. Yes, sometimes there is a slight leak when shaking... I found that is from formula powder getting stuck between the nipple and the bottle, and breaking the seal. So, when it happens I just wipe the rim of the bottle, take the nipple out of the ring, rinse the nipple and ring, and then the problem's gone. These bottle seem virtually indestructible to me, and haven't discolored with age of anything. (Although, old nipples do discolor.)It's hard to believe my mom gave me bottles with little bags in side... what a pain and mess that must have been!!!",5,191,1.620650696503464
Philips Avent 3 Pack 9oz Bottles,"I used these bottles with my first child.  I noticed they leaked occasionally which was frustrating, but I refused to buy a whole new bottle system when my second child came along.  I had about 17 bottles and liked having so many. I've been reading the reviews of how to keep it from leaking, and am going to try the advice of  Sherri M. Cottle Chelsea, Alabama) Her review says she called the 1800 number to avent and was told what to do. You have to put the nipple in the white ring and then put the cap on that and then you put that on the bottle and tighten it by the CAP..not the white ring...If you tighten it with the clear platic cap the white ring will stop when its tight enough on its own, preventing the leakage. She swears this works!After having to repack my diaper bag several times b/c of leaky bottles, I've learned to put the bottles in a ziploc bag.  Then if it leaks, you don't have a messy, wet bag!  (I like to put water in the bottle and carry 3 bottles in a large ziploc zipper bag and carry the formula in a dispenser.)As far as colic, both my children weren't colicy.  They were occasionally gassy.  My sister-in-law gave me the advice to put a couple of Mylecon (or I used little tummies b/c it's cheaper)drops in each bottle to ""get rid of the bubbles"".  I did this with both of my children the first few months.  It worked for me.Also, for the relief of my children's occasional gas, a friend recommended Baby's Bliss Gripe Water.  I googled it and purchased it off of the internet.  It's an herbal supplement used to ease the gas & stomach discomfort often associated with colic, hiccups, and teething.  [...]",3,191,1.620650696503464
Philips Avent 3 Pack 9oz Bottles,"We used Avent bottles for several weeks, but our baby was spitting up _all the time_, seemed like she was choking during feedings, and had gas all the time.  We switched to the Playtex VentAire bottles when she was 6 weeks old, and problem solved! No more crying from gas, she hardly ever spits up anymore, and she has a much easier time at feedings.  The flow is slower and it really does cut down on the amount of air she takes in during feedings.  So, I highly recommend trying something other than the Avent bottles for small infants.  Maybe later, when our baby is a bit older we'll pull out the Avent bottles again, but for now, we aren't using anything except Playtex VentAire.",1,191,1.620650696503464
Philips Avent 3 Pack 9oz Bottles,"These bottles are the worst bottles because of the leaking!! They leak all over you and the baby no matter how the lid is put on, AND you shouldn't even have to worry about if you even put the lid on so precisly right. I mean it shouldn't be rocket science here makers of AVENT! SO my recommendation is NO don't waste your $$",1,191,1.620650696503464
Philips Avent 3 Pack 9oz Bottles,"I used these bottles when I decided to supplement with formula at 3 weeks.  My daughter didn't really have any problems switching back and forth between the breast and bottle.  She is completely weaned at this point and doing well with these bottles.  I am glad I decided to go with the 9 oz bottles from the start, as she quickly went from 4 oz to 6 oz and I would have had to buy new bottles if i had originally purchased the 4 oz bottles.  We had some minor problems with leaks, and then I actually read the instructions that came with the bottles.  The secret is to reassemble the nipple/ring while the nipple and ring are still wet.  That seemed to solve our leaking problems.  I would highly recommend these bottles to anyone.",5,191,1.620650696503464
Philips Avent 3 Pack 9oz Bottles,"this bottle started out ok until after about 5 months of usage, it started leaking around the collar no matter how tight the collar was screwed on.  this was so annoying, especially at night when you are sleepy.  you have to remove the collar and nipple, put it back on, turn it upside down and pray that this time it wont leak (after going through this a few time you will want to throw the bottle into the wall).  eventually you will get lucky and the bottle wont leak but for the next feeding you go through this process all over again.  try the playtex disposable nurser (the drop in liner is fabulous), buy the one with the avent-like nipple.  so far this is excellent, no leaks and no wash.",2,191,1.620650696503464
Philips Avent 3 Pack 9oz Bottles,"I do not know what the problem is with so many of the reviewers' bottles here, but I have been using the Avent system EXCLUSIVELY since my son was born 4 weeks ago and they have NEVER ONCE LEAKED!  I can only say to prospective buyers that you should TRY the bottles first before making your decision.  My son LOVES the Avent bottles and goes from bottle to breast with absolutely NO NIPPLE CONFUSION.  I LOVE them!",5,191,1.620650696503464
Philips Avent 3 Pack 9oz Bottles,"I have used three different bottle for my 3 month old son now.  He gets horrible gas and avent bottles are supposed to help with that, but for me they dont. ALso they leak all the time.  The only good thing about them is that unlike the plytex bottles i use now, the avent bottles have several stages of nippples so there is always one that is the perfect speed for your baby.  Personally i have had more luck with the playtex ventaire bottles and the playtex nursers.  They allow less air to get in babys belly, but they only 2 nipple stages, fast and slow. Its good to register for several differnt bottles and let your baby decide which ones are right for them!",2,191,1.620650696503464
Philips Avent 3 Pack 9oz Bottles,"I am breastfeeding currently but I do like to leave the house every so often. When I get the chance I'll pump directly into one of these bottles using the Isis pump. I love the nipples of this bottle because they are the most like the human nipple and my baby has not developed nipple confusing because of this. One thing that all Avent users should know...if you read the directions carefully for the pump, the makers tell you not to use anti-bacterial soap on any of their products. Doing so can cause the plastic to crack. I just wash all the parts as directed using regular dish soap and then sterilize all the parts using the Avent sterilizer. That too is convenient and easy to use.I would recommend these bottles to any woman who is breastfeeding and will have to return to work. Yes, they cost more than most bottles, but if you can afford that little extra you will be very pleased with the results.",5,191,1.620650696503464
Philips Avent 3 Pack 9oz Bottles,"We used these bottles with my little sister 6 years ago, & I started my son on them (with breastmilk) from birth.  It's very easy for them to go from breast to bottle, I loved the pop-in cap for storage, and ALL Avent pieces are interchangeable!! I had to switch to Dr. Brown's recently because my baby has severe gas problems, but I would have stayed with Avent except for that. They're so easy to clean because of the wideness.P.S. As for everyone complaining they leak, READ THE INSTRUCTIONS!! I read a recent review saying she didn't know why they left room between the threads that screw on the cap & nipple, the bottle info explicitly says this is to let air vent out, that is why they leak when you screw the cap on too tight. It just takes a light twist & it's on. If you've got a really gassy baby, go with Dr. Brown, otherwise, these are awesome for the breastfed baby!",4,191,1.620650696503464
Philips Avent 3 Pack 9oz Bottles,"I purchased these bottles after hearing how wonderful they were. I breastfed my daughter for her first year, so we didn't use them that often. When she was weaned, and started on formula we started having problems. Everytime my husband or I would screw on the ring, milk poured out everywhere! There was no right way to screw the damn rings on... it was just pure luck, and it took numerous times each feeding to get it on right. The milk would pour out from underneath the ring (not from the nipple). My first thought was that I just got a bad batch... but I had bought them at different times, then I thought that the dishwasher was somehow warping them. Well, if that's the case then forget about Avent!! I don't have the time to handwash all her bottles, and if I did find the time, I still wouldn't.I read through the reviews to see if it was just me... I found many reviews just like mine. Then I found myself laughing at the reviews that instruct you on how to create the perfect seal. I gotta tell you, I put up with these stupid bottles for far too long, and they are expensive, so I held off on buying new ones. It felt so good to throw these in the trash. There is no need to have to spend the time on the ""perfect seal"", when there are other brands that work so much better! We finally threw them all out and bought another brand, Soothie, so far have been wonderful!Don't waste your money on this brand.*The sippy cups are just as bad. I've forgotten about them several times, and they've tipped on their side inside her diaper bag and they leak even with the lids on tight.",1,191,1.620650696503464
Philips Avent 3 Pack 9oz Bottles,"I have a 6 week old daughter and have tried using the Avent bottle to supplement breast feedings.  Unfortunately, I have found this bottle to be worthless for anything except storing pumped breast milk.  It is extremely difficult for my daughter to suck anything out of this nipple.  I too have found leakage from the nipple ring, making for a very sloppy feeding session.  I have since bought and used the Playtex VentAire bottles and haven't had any difficulties.  The shape of the Playtex VentAire bottles are also much easier for feeding.  I would not reccomend the Avent to anyone unless their baby has an impressively strong suck.",2,191,1.620650696503464
Philips Avent 3 Pack 9oz Bottles,"I as many mothers did my research ino which bottles are the best and I read about all the wounderful things that the avent bottles do for the baby. I started to notice that the bottles were leaking. I thought maybe it's that particular one so I threw it away, only to realize it wasn't the bottle, it was all of them. When I contacted avent, they  told me that if the bottles are over tightened or if the nipple isn't assembled with the cap when it was wet that the will leak. I don't know about you but a 2am I don't want to be changing my two week old because her bottle leaked all over her. Please keep this in mind when looking at bottles.",1,191,1.620650696503464
Philips Avent 3 Pack 9oz Bottles,"Based on a number of reviews in prominent magazines and literature, we decided to go with the Avent bottles. A pity I did not think of having a look on Amazon. These bottles leak bad. Tight or loose, wet or dry, old or new does not matter. Unfortunately we are stuck with the investment and are just being carefull when using. Replacing them with others are not an option. DO NOT BUY!",1,191,1.620650696503464
Philips Avent 3 Pack 9oz Bottles,"I bought these bottles, and they are great!! I was also suprised to see amazon shipped them in bubble wrap to prevent breaks and the package was completly sealed in sterile plastic!!",5,191,1.620650696503464
Philips Avent 3 Pack 9oz Bottles,I agree with several other Mom's regarding the leaking bottles. It is so frustrating to loose precious Mothers Milk because of a leaky bottle or have messy sticky formula all over your kitchen floor. I would not use them if they had not been given to me as a shower gift.,2,191,1.620650696503464
Philips Avent 3 Pack 9oz Bottles,"I got my first bottles as a gift from a friend, the bottle works great, easy to clean doesnt cause gas &amp; my baby seems happy with it. BUT rarely, it leaks from the ring, which many just mention. The price is higher than most brand. I will suggest the sample pack that comes 1 X 9oz, 1X4 oz, 1X disposable nurser+liner, pacifier &amp; travel carrier for nipples for $ 19.99 , that is the cheapest way you can try it with min dollar...",4,191,1.620650696503464
Philips Avent 3 Pack 9oz Bottles,"My son is now only 4 weeks old and I have been using these bottles since his birth.  It seems that the more I wash and sterilize them, the more I get leaks in them.  In the middle of the night feedings, he's getting all wet, and so am I.  I try to fix the problem; he's screaming all over the place.  Don't waste your time with Avent bottles.",2,191,1.620650696503464
Philips Avent 3 Pack 9oz Bottles,"I use these on occasion when we are out and breastfeeding isn't possible. My daughter loves these bottles and won't take anything else. We have tried several different brands and these work great. They are supposedly designed more like the breast. As a OB/Gyn nurse, I would have to agree. Not once have we had a problem with leaking, gagging or choking that we had with other bottles. A++++",5,191,1.620650696503464
Philips Avent 3 Pack 9oz Bottles,"I have been using these bottles for my 5 month old since she was born.  She was breastfed for the first 2 1/2 months, but we always supplemented or pumped.  Now she is exclusivly bottle fed.I did have a problem with them leaking a few times ( as did my sister in law ) , but I just unscrewed the top and screwed it back on , and everything was fine .  Another time , the nipple had cracked and the formula was pouring out, but a new nipple ( upgraded to a 3 mth+) fixed that problem.  This is my first baby and the only bottles I have ever used , so I don't have much to compare to, but I have been happy with them so far and have just purchased my first Avent cup for my DD.",4,191,1.620650696503464
Philips Avent 3 Pack 9oz Bottles,"I have been using these bottles for about 5 months now.  I really like them.  They do leak on occasion for me, usally when I do not have the top screwed on right.  I find that if the seal between the nipple & the bottle is not right, then you will get a leak.  I solve this problem by just unscrewing the nipple/lid and then rescrewing it on SLOWLY so I know it is getting a good tight even seal.  This always works!",5,191,1.620650696503464
